{
  "schema_version": "1.0.0",
  "sample": {
    "path": "/tmp/CSX.exe",
    "filename": "CSX.exe",
    "size_bytes": 6175744,
    "sha256": "683520631b81a7283e9d7c0870115867ed29630a782348119308d22eae1b6f31",
    "sha1": "2d0de7e0919b2f2f72dd9388d7c6510513acd132",
    "md5": "d1e7416fa2ef5031f963cb0585a97629",
    "mime_type": null,
    "collected_at": "2026-09-25T17:18:52.986118Z"
  },
  "host": {
    "os": "Linux-6.1.158+-x86_64-with-glibc2.36",
    "arch": "x86_64",
    "python_version": "3.11.2",
    "hostname": "e2b.local",
    "tool_versions": {
      "readelf": "GNU readelf (GNU Binutils for Debian) 2.40",
      "objdump": "GNU objdump (GNU Binutils for Debian) 2.40",
      "nm": "GNU nm (GNU Binutils for Debian) 2.40",
      "strings": "GNU strings (GNU Binutils for Debian) 2.40",
      "ldd": "ldd (Debian GLIBC 2.36-9+deb12u14) 2.36",
      "unzip": "caution:  both -n and -o specified; ignoring -o",
      "jinja2": "3.1.6",
      "jsonschema": "4.26.0",
      "pefile": "2024.8.26",
      "capstone": "5.0.9"
    }
  },
  "started_at": "2026-09-25T17:18:53.016328Z",
  "finished_at": "2026-09-25T17:18:56.529213Z",
  "analyzers": [
    {
      "analyzer": "metadata",
      "version": "1.0.0",
      "started_at": "2026-09-25T17:18:53.020564Z",
      "finished_at": "2026-09-25T17:18:53.044665Z",
      "duration_ms": 24,
      "status": "ok",
      "findings": [
        {
          "id": "meta.hash.sha256",
          "category": "metadata",
          "title": "SHA256",
          "description": "SHA256 للعينة = 683520631b81a7283e9d7c0870115867ed29630a782348119308d22eae1b6f31",
          "confidence": "proven",
          "provenance": "observed",
          "source": "metadata:hashlib.sha256",
          "method": "hashlib.sha256 over file bytes",
          "evidence_refs": [],
          "data": {
            "sha256": "683520631b81a7283e9d7c0870115867ed29630a782348119308d22eae1b6f31"
          },
          "tags": []
        },
        {
          "id": "meta.size",
          "category": "metadata",
          "title": "حجم الملف",
          "description": "حجم الملف 6175744 بايت",
          "confidence": "proven",
          "provenance": "observed",
          "source": "metadata:stat",
          "method": "stat.st_size",
          "evidence_refs": [],
          "data": {
            "size_bytes": 6175744
          },
          "tags": []
        },
        {
          "id": "meta.timestamps",
          "category": "metadata",
          "title": "طوابع زمنية لنظام الملفات",
          "description": "mtime/ctime من نظام الملفات (قد لا تعكس وقت البناء)",
          "confidence": "proven",
          "provenance": "observed",
          "source": "metadata:stat",
          "method": "stat.st_mtime/ctime",
          "evidence_refs": [],
          "data": {
            "mtime": "2026-09-25T17:18:40.926354Z",
            "ctime": "2026-09-25T17:18:40.926354Z",
            "mode": "0o644"
          },
          "tags": []
        },
        {
          "id": "meta.magic_bytes",
          "category": "metadata",
          "title": "Magic bytes",
          "description": "أول 16 بايت hex: 4d5a90000300000004000000ffff0000",
          "confidence": "proven",
          "provenance": "observed",
          "source": "metadata:read",
          "method": "read first 16 bytes",
          "evidence_refs": [],
          "data": {
            "magic_hex": "4d5a90000300000004000000ffff0000"
          },
          "tags": []
        }
      ],
      "artifacts": [],
      "errors": [],
      "warnings": [],
      "raw": {
        "sha256": "683520631b81a7283e9d7c0870115867ed29630a782348119308d22eae1b6f31",
        "size": 6175744,
        "file": "",
        "mime": null
      }
    },
    {
      "analyzer": "platform",
      "version": "1.0.0",
      "started_at": "2026-09-25T17:18:53.044973Z",
      "finished_at": "2026-09-25T17:18:53.117350Z",
      "duration_ms": 72,
      "status": "ok",
      "findings": [
        {
          "id": "platform.format",
          "category": "platform",
          "title": "صيغة الملف / المنصة",
          "description": "الصيغة المكتشفة: PE | المعمارية: x86 | البت: unknown",
          "confidence": "proven",
          "provenance": "observed",
          "source": "platform:pe_magic",
          "method": "pe_magic",
          "evidence_refs": [],
          "data": {
            "format": "PE",
            "arch": "x86",
            "machine": 332
          },
          "tags": []
        },
        {
          "id": "platform.runtime_hints",
          "category": "platform",
          "title": "تلميحات Runtime / اللغة",
          "description": "تلميحات لغوية/تقنية مستنتجة من strings و readelf",
          "confidence": "low",
          "provenance": "inferred",
          "source": "platform:strings+readelf",
          "method": "keyword search in strings",
          "evidence_refs": [],
          "data": {
            "hints": [
              "JVM",
              "Rust",
              "Node.js",
              "Python"
            ]
          },
          "tags": [
            "heuristic"
          ]
        }
      ],
      "artifacts": [],
      "errors": [],
      "warnings": [],
      "raw": {
        "format": "PE",
        "arch": "x86",
        "machine": 332,
        "detector": "pe_magic",
        "strings_hints": [
          "JVM",
          "Rust",
          "Node.js",
          "Python"
        ]
      }
    },
    {
      "analyzer": "structure",
      "version": "1.0.0",
      "started_at": "2026-09-25T17:18:53.117739Z",
      "finished_at": "2026-09-25T17:18:53.326199Z",
      "duration_ms": 208,
      "status": "ok",
      "findings": [
        {
          "id": "struct.pe.sections",
          "category": "structure",
          "title": "PE Sections",
          "description": "PE entry 0x22052 base 0x400000 sections=7",
          "confidence": "proven",
          "provenance": "observed",
          "source": "structure:pefile",
          "method": "pefile.PE",
          "evidence_refs": [],
          "data": {
            "pe_sections": [
              {
                "Name": ".text",
                "VirtualAddress": "0x1000",
                "Misc_VirtualSize": 227065,
                "SizeOfRawData": 227328
              },
              {
                "Name": ".mmap",
                "VirtualAddress": "0x39000",
                "Misc_VirtualSize": 581,
                "SizeOfRawData": 1024
              },
              {
                "Name": ".rdata",
                "VirtualAddress": "0x3a000",
                "Misc_VirtualSize": 68000,
                "SizeOfRawData": 68096
              },
              {
                "Name": ".data",
                "VirtualAddress": "0x4b000",
                "Misc_VirtualSize": 7944,
                "SizeOfRawData": 3584
              },
              {
                "Name": ".fptable",
                "VirtualAddress": "0x4d000",
                "Misc_VirtualSize": 128,
                "SizeOfRawData": 512
              },
              {
                "Name": ".rsrc",
                "VirtualAddress": "0x4e000",
                "Misc_VirtualSize": 5862968,
                "SizeOfRawData": 5863424
              },
              {
                "Name": ".reloc",
                "VirtualAddress": "0x5e6000",
                "Misc_VirtualSize": 10452,
                "SizeOfRawData": 10752
              }
            ],
            "pe_entry": "0x22052",
            "pe_image_base": "0x400000"
          },
          "tags": []
        }
      ],
      "artifacts": [],
      "errors": [],
      "warnings": [],
      "raw": {
        "pe_sections": [
          {
            "Name": ".text",
            "VirtualAddress": "0x1000",
            "Misc_VirtualSize": 227065,
            "SizeOfRawData": 227328
          },
          {
            "Name": ".mmap",
            "VirtualAddress": "0x39000",
            "Misc_VirtualSize": 581,
            "SizeOfRawData": 1024
          },
          {
            "Name": ".rdata",
            "VirtualAddress": "0x3a000",
            "Misc_VirtualSize": 68000,
            "SizeOfRawData": 68096
          },
          {
            "Name": ".data",
            "VirtualAddress": "0x4b000",
            "Misc_VirtualSize": 7944,
            "SizeOfRawData": 3584
          },
          {
            "Name": ".fptable",
            "VirtualAddress": "0x4d000",
            "Misc_VirtualSize": 128,
            "SizeOfRawData": 512
          },
          {
            "Name": ".rsrc",
            "VirtualAddress": "0x4e000",
            "Misc_VirtualSize": 5862968,
            "SizeOfRawData": 5863424
          },
          {
            "Name": ".reloc",
            "VirtualAddress": "0x5e6000",
            "Misc_VirtualSize": 10452,
            "SizeOfRawData": 10752
          }
        ],
        "pe_entry": "0x22052",
        "pe_image_base": "0x400000"
      }
    },
    {
      "analyzer": "strings",
      "version": "1.0.0",
      "started_at": "2026-09-25T17:18:53.326366Z",
      "finished_at": "2026-09-25T17:18:53.562404Z",
      "duration_ms": 236,
      "status": "ok",
      "findings": [
        {
          "id": "strings.summary",
          "category": "strings",
          "title": "ملخص السلاسل",
          "description": "إجمالي 137384 سلسلة ascii (+ 833 utf16)",
          "confidence": "proven",
          "provenance": "observed",
          "source": "strings:strings(1)",
          "method": "strings -a -n 4",
          "evidence_refs": [],
          "data": {
            "ascii": 137384,
            "utf16": 833
          },
          "tags": []
        },
        {
          "id": "strings.urls",
          "category": "strings",
          "title": "URLs مكتشفة",
          "description": "عناوين URL مستخرجة من السلاسل",
          "confidence": "high",
          "provenance": "observed",
          "source": "strings:regex",
          "method": "regex https?://",